{
  "schema": "contraste.sources/v1",
  "researched": "2026-10-04",
  "note": "Every data and scenario source the plan names, with the verbatim fragment of its licence or terms and its redistribution class (research dossier 08, the master matrix; SGCD from dossier 07). A source whose licence is UNVERIFIED keeps the class the research could support and lists the open question. A link-only or unusable source is linked, never read by a case. Fetch specifications are added by the unit that first reads the source, after the download is verified.",
  "classes": {
    "mirror-allowed": "raw rows may be committed or re-hosted, with attribution where required",
    "derived-only": "raw data may be downloaded by the pipeline; only aggregates, fitted parameters and results derived from it are committed and replayed",
    "link-only": "fetched at run time from the publisher at most; neither raw rows nor substantial derived extracts are redistributed; the web only links",
    "unusable": "the terms forbid the intended use, or the data is not publicly obtainable"
  },
  "sources": [
    {"id": "uci-german", "name": "Statlog (German Credit Data)", "publisher": "UCI Machine Learning Repository / H. Hofmann", "landing": "https://archive.ics.uci.edu/dataset/144/statlog+german+credit+data", "doi": "10.24432/C5NC77", "licence": "This dataset is licensed under a Creative Commons Attribution 4.0 International (CC BY 4.0) license.", "class": "mirror-allowed", "attribution": "Hofmann, H. (1994). Statlog (German Credit Data). UCI Machine Learning Repository. https://doi.org/10.24432/C5NC77", "access": "direct download", "format": "text", "span": "1994 snapshot", "granularity": "applicant", "fit": "PD scoring, cost-sensitive cut-offs", "cases": ["C01", "C20"], "unverified": [],
     "fetch": {"kind": "http", "files": [{"name": "statlog+german+credit+data.zip", "url": "https://archive.ics.uci.edu/static/public/144/statlog+german+credit+data.zip"}]}},
    {"id": "uci-taiwan", "name": "Default of Credit Card Clients (Taiwan)", "publisher": "UCI Machine Learning Repository / I-C. Yeh", "landing": "https://archive.ics.uci.edu/dataset/350/default+of+credit+card+clients", "doi": "10.24432/C55S3H", "licence": "This dataset is licensed under a Creative Commons Attribution 4.0 International (CC BY 4.0) license.", "class": "mirror-allowed", "attribution": "Yeh, I-C. (2009). Default of Credit Card Clients. UCI Machine Learning Repository. https://doi.org/10.24432/C55S3H", "access": "direct download", "format": "xls", "span": "April to September 2005", "granularity": "account", "fit": "PD scoring, behavioural features", "cases": ["C01", "C20"], "unverified": [],
     "fetch": {"kind": "http", "files": [{"name": "default+of+credit+card+clients.zip", "url": "https://archive.ics.uci.edu/static/public/350/default+of+credit+card+clients.zip"}]}},
    {"id": "uci-polish", "name": "Polish Companies Bankruptcy", "publisher": "UCI Machine Learning Repository / S. Tomczak", "landing": "https://archive.ics.uci.edu/dataset/365/polish+companies+bankruptcy+data", "doi": "10.24432/C5F600", "licence": "This dataset is licensed under a Creative Commons Attribution 4.0 International (CC BY 4.0) license.", "class": "mirror-allowed", "attribution": "Tomczak, S. (2016). Polish Companies Bankruptcy. UCI Machine Learning Repository. https://doi.org/10.24432/C5F600", "access": "direct download", "format": "arff", "span": "2000 to 2013", "granularity": "firm-year, 1 to 5 year horizons", "fit": "corporate PD, horizon term structure", "cases": ["C02", "C20"], "unverified": ["whether 10,503 instances is the total or one file, and whether firms repeat across the five horizon files (no firm identifier)"],
     "fetch": {"kind": "http", "files": [{"name": "polish+companies+bankruptcy+data.zip", "url": "https://archive.ics.uci.edu/static/public/365/polish+companies+bankruptcy+data.zip"}]}},
    {"id": "uci-australian", "name": "Statlog (Australian Credit Approval)", "publisher": "UCI Machine Learning Repository / R. Quinlan", "landing": "https://archive.ics.uci.edu/dataset/143/statlog+australian+credit+approval", "doi": "10.24432/C59012", "licence": "This dataset is licensed under a Creative Commons Attribution 4.0 International (CC BY 4.0) license.", "class": "mirror-allowed", "attribution": "Quinlan, R. (1987). Statlog (Australian Credit Approval). UCI Machine Learning Repository. https://doi.org/10.24432/C59012", "access": "direct download", "format": "text", "span": "undated", "granularity": "applicant (anonymised)", "fit": "small-sample benchmark", "cases": [], "unverified": [],
     "fetch": {"kind": "http", "files": [{"name": "statlog+australian+credit+approval.zip", "url": "https://archive.ics.uci.edu/static/public/143/statlog+australian+credit+approval.zip"}]}},
    {"id": "santanderai-sgcd", "name": "Stressed German Credit Dataset (SGCD-v0.1)", "publisher": "Santander AI Lab", "landing": "https://github.com/SantanderAI/sota-stressed-datasets", "licence": "data CC BY 4.0 (same as the mother dataset, Statlog German Credit); validation tooling Apache-2.0; the dataset card forbids real-world credit scoring use", "class": "mirror-allowed", "attribution": "Santander AI Lab, sota-stressed-datasets, SGCD-v0.1 (CC BY 4.0), derived from Statlog German Credit, UCI, https://doi.org/10.24432/C5NC77", "access": "GitHub repository", "format": "jsonl", "span": "1,000 records in 20 ordered batches", "granularity": "applicant", "fit": "data-quality stress testing of a credit model (seen and held-out shocks)", "cases": ["C20"], "unverified": [], "fetch": null},
    {"id": "kaggle-gmsc", "name": "Give Me Some Credit", "publisher": "Kaggle (2011)", "landing": "https://www.kaggle.com/competitions/GiveMeSomeCredit/rules", "licence": "licence field \"Subject to Competition Rules\"; no data-use grant", "class": "link-only", "access": "Kaggle login plus rules acceptance", "format": "csv", "span": "UNVERIFIED", "granularity": "borrower", "fit": "PD scoring", "cases": [], "unverified": ["any data-use right beyond the competition; the time span of the data"], "fetch": null},
    {"id": "kaggle-home-credit", "name": "Home Credit Default Risk", "publisher": "Home Credit Group", "landing": "https://www.kaggle.com/competitions/home-credit-default-risk/rules", "licence": "you may access and use the Competition Data only for the purposes of the Competition", "class": "unusable", "access": "Kaggle login", "format": "csv", "span": "UNVERIFIED", "granularity": "application plus bureau history", "fit": "(none)", "cases": [], "unverified": [], "fetch": null},
    {"id": "fico-heloc", "name": "FICO HELOC (Explainable Machine Learning Challenge)", "publisher": "FICO", "landing": "https://community.fico.com/s/explainable-machine-learning-challenge", "licence": "data usage agreement required; text UNVERIFIED", "class": "unusable", "access": "request form (defunct)", "format": "csv", "span": "UNVERIFIED", "granularity": "applicant", "fit": "explainability", "cases": [], "unverified": ["the data usage agreement text and current availability (the challenge page redirects)"], "fetch": null},
    {"id": "lendingclub", "name": "LendingClub loan data", "publisher": "LendingClub", "landing": "https://www.lendingclub.com/info/download-data.action", "licence": "official terms UNVERIFIED; the Kaggle mirror's \"CC0\" is uploader-assigned", "class": "unusable", "access": "none official", "format": "csv", "span": "2007 to 2020 (mirror)", "granularity": "loan", "fit": "PD, LGD", "cases": [], "unverified": ["whether the official download pages still exist for logged-in browsers, and their terms"], "fetch": null},
    {"id": "bondora", "name": "Bondora loan data", "publisher": "Bondora / Go & Grow", "landing": "https://goandgrow.eu/en/public-reports", "licence": "page \"being revamped\"; LoanData.zip 403; terms UNVERIFIED", "class": "unusable", "access": "none today", "format": "csv", "span": "UNVERIFIED", "granularity": "loan", "fit": "PD, LGD", "cases": [], "unverified": ["whether LoanData returns after the revamp, and its terms"], "fetch": null},
    {"id": "prosper", "name": "Prosper loan data", "publisher": "Prosper", "landing": "https://help.prosper.com/hc/en-us/articles/210013083", "licence": "account and \"Data License Agreement\" (search snippet)", "class": "unusable", "access": "account", "format": "csv", "span": "UNVERIFIED", "granularity": "loan", "fit": "PD", "cases": [], "unverified": ["the Data License Agreement text"], "fetch": null},
    {"id": "freddie-mac-sflld", "name": "Freddie Mac Single-Family Loan-Level Dataset", "publisher": "Freddie Mac", "landing": "https://www.freddiemac.com/research/datasets/sf-loanlevel-dataset", "licence": "make your academic or research results and any related Derived Products available to the public, provided that any such distribution is solely for noncommercial purposes and further provided that the same does not include and cannot be used to derive or recreate any part of the Single-Family Loan-Level Dataset", "class": "derived-only", "attribution": "Freddie Mac Single-Family Loan-Level Dataset, terms effective November 2025; noncommercial use only", "access": "registration (Clarity Data Intelligence)", "format": "pipe-delimited text (UNVERIFIED)", "span": "originations 1999 to 2026Q1, performance to 2026-03-31", "granularity": "loan-month", "fit": "lifetime PD, IFRS 9 staging, ECL, LGD, prepayment", "cases": ["C06", "C08"], "unverified": ["total file size and exact file format of the current release", "whether the terms allow derived aggregates in a public web (BL-037)"], "fetch": null},